ref,title,year,source,selection_criteria,status,display,input,interaction,collaboration,model,size,doi
,Paper-top interface for supporting note-taking and its preliminary experiment,2010,IEEE Digital Library,Study describing digital tabletop techniques,Accepted,Front-Projected,"Tangible-Tokens, Vision-Based",Tangibility,Usuário único,,,10.1109/ICSMC.2010.5642448
,Venice unfolding: A tangible user interface for exploring faceted data in a geographical context,2010,Scopus,Study describing digital tabletop application that mentions the hardware used,Accepted,Rear-Projected,"Sensor-Assisted-Vision-Based, Tangible-Tokens, Vision-Based",Tangibility,Colaboração presencial,,,10.1145/1868914.1869019
,It's just a toolbar! using tangibles to help children manage conflict around a multi-touch tabletop,2010,ACM Digital Library,Study describing digital tabletop application that mentions the hardware used,Accepted,Rear-Projected,"Sensor-Assisted-Vision-Based, Vision-Based","Multi-touch, Touch",Colaboração presencial,Microsoft Surface,30”,10.1145/1935701.1935709
,Interfering and resolving: How tabletop interaction facilitates co-construction of argumentative knowledge,2010,Springer Link,Study describing digital tabletop techniques,Accepted,Rear-Projected,"Tangible-Tokens, Vision-Based","Multi-touch, Tangibility, Touch",Colaboração presencial,reacTable,,10.1007/s11412-010-9101-9
,Tangible anchoring: Grasping news and public opinion,2010,Scopus,Study describing digital tabletop techniques,Accepted,Rear-Projected,"Pen, Tangible-Tokens, Vision-Based","Multi-touch, Tangibility, Touch",Colaboração presencial,,,10.1145/1971630.1971653
,Haptic u-Table: A Believable Feedback System with a Quasi-tangible Tabletop Interface,2010,IEEE Digital Library,Study describing digital tabletop techniques,Accepted,Rear-Projected,"Sensor-Assisted-Vision-Based, Tangible-Tokens, Vision-Based","Multi-touch, Tangibility, Touch",Colaboração presencial,u-Table,59”,10.1109/UIC-ATC.2010.21
,EGrid: supporting the control room operation of a utility company with multi-touch tables,2010,ACM Digital Library,Study describing digital tabletop application that mentions the hardware used,Accepted,Rear-Projected,"Sensor-Assisted-Vision-Based, Vision-Based","Multi-touch, Touch",Colaboração presencial,Microsoft Surface,30”,10.1145/1936652.1936720
,G-nome surfer: a tabletop interface for collaborative exploration of genomic data,2010,ACM Digital Library,Study describing digital tabletop application that mentions the hardware used,Accepted,Rear-Projected,"Sensor-Assisted-Vision-Based, Vision-Based","Multi-touch, Touch",Colaboração presencial,Microsoft Surface,30”,10.1145/1753326.1753539
,"RoboJockey: real-time, simultaneous, and continuous creation of robot actions for everyone",2010,ACM Digital Library,Study describing digital tabletop application that mentions the hardware used,Accepted,Embedded,"Pen, Electrical-Based","Multi-touch, Touch",Colaboração presencial,LCD-AD221FB-T by IO Data,"21.5""",10.1145/1971630.1971646
,Raptor: sketching games with a tabletop computer,2010,ACM Digital Library,Study describing digital tabletop application that mentions the hardware used,Accepted,Rear-Projected,"Sensor-Assisted-Vision-Based, Vision-Based","Multi-touch, Touch",Colaboração presencial,Microsoft Surface,30”,10.1145/1920778.1920805
,Alerting Accidents with Ambiguity: A Tangible Tabletop Application for Safe and Independent Chemistry Experiments,2010,Springer Link,Study describing digital tabletop application that mentions the hardware used,Accepted,Front-Projected,"Tangible-Tokens, Vision-Based",Tangibility,Usuário único,,,10.1007/978-3-642-16355-5_14
,A-CUBE: A Tangible Tabletop Application to Support Safe and Independent Chemistry Experiments,2010,IEEE Digital Library,Study describing digital tabletop techniques,Accepted,Front-Projected,"Tangible-Tokens, Vision-Based",Tangibility,Usuário único,,,10.1109/UIC-ATC.2010.120
,Touching the depths: introducing tabletop interaction to reservoir engineering,2010,ACM Digital Library,Study describing digital tabletop application that mentions the hardware used,Accepted,Rear-Projected,"Sensor-Assisted-Vision-Based, Vision-Based","Multi-touch, Touch",Colaboração presencial,Microsoft Surface,30”,10.1145/1936652.1936671
,"Move, Beam, and Check! Imagineering Tangible Optical Chess on An Interactive Tabletop Display",2010,ACM Digital Library,Study describing digital tabletop application that mentions the hardware used,Accepted,Rear-Projected,Sensor-Assisted-Vision-Based,"Multi-touch, Tangibility, Touch",Colaboração presencial,TTT (Tangible Tracking Table),,10.1145/1902593.1902599
,Tangible navigation and object manipulation in virtual environments,2010,ACM Digital Library,Study describing digital tabletop application that mentions the hardware used,Accepted,Rear-Projected,Vision-Based,"Multi-touch, Tangibility, Touch",Colaboração presencial,,50”,10.1145/1935701.1935710
,TOUCHtr4ck: democratic collaborative music,2010,ACM Digital Library,Study describing digital tabletop application that mentions the hardware used,Accepted,Rear-Projected,Sensor-Assisted-Vision-Based,"Multi-touch, Touch",Colaboração presencial,,,10.1145/1935701.1935773
,Development of eye-tracking pen display based on stereo bright pupil technique,2010,ACM Digital Library,Study describing digital tabletop techniques,Accepted,Front-Projected,"Pen, Eye-Tracking","Gaze, Tangibility",Usuário único,,,10.1145/1743666.1743707
,Development of eye-tracking tabletop interface for media art works,2010,ACM Digital Library,Study describing digital tabletop techniques,Accepted,Front-Projected,"Pen, Eye-Tracking, Sensor-Assisted-Vision-Based","Gaze, Tangibility",Colaboração presencial,,,10.1145/1936652.1936723
,Various tangible devices suitable for mixed reality interactions,2010,IEEE Digital Library,Study describing digital tabletop application that mentions the hardware used,Accepted,Rear-Projected,"Sensor-Assisted-Vision-Based, Tangible-Tokens, Vision-Based","Gesture, Tangibility",Usuário único,,,10.1109/ISMAR.2010.5643608
,Designing social games for children and older adults: Two related case studies,2010,Science@Direct,Study describing digital tabletop application that mentions the hardware used,Accepted,Front-Projected,"Tangible-Tokens, Vision-Based",Tangibility,Colaboração presencial,,,10.1016/j.entcom.2010.09.001
,Search on surfaces: Exploring the potential of interactive tabletops for collaborative search tasks,2010,Science@Direct,Study evaluating digital tabletop techniques,Accepted,Front-Projected,Electrical-Based,"Multi-touch, Touch",Colaboração presencial,DiamondTouch,42”,10.1016/j.ipm.2009.10.004
,Towards New Human-Machine Systems in contexts involving interactive table and tangible objects,2010,Science@Direct,Study describing digital tabletop techniques,Accepted,Embedded,Tangible-Tokens,Tangibility,Colaboração presencial,TangiSense,42.5”,10.3182/20100831-4-FR-2021.00015
,Analysing Tabletop Based Computer Supported Collaborative Learning Data through Visualization,2011,Springer Link,Study describing digital tabletop application that mentions the hardware used,Accepted,Front-Projected,Pen,Tangibility,Colaboração presencial,Promethean ActivBoard,,10.1007/978-3-642-25191-7_32
,An interaction on a flat panel display using a planar 1-DOF electrostatic actuator,2011,ACM Digital Library,Study describing digital tabletop techniques,Accepted,Embedded,Tangible-Tokens,Tangibility,Usuário único,,,10.1145/2076354.2076404
,Balancing Act: Enabling Public Engagement with Sustainability Issues through a Multi-touch Tabletop Collaborative Game,2011,Springer Link,Study describing digital tabletop application that mentions the hardware used,Accepted,Rear-Projected,"Sensor-Assisted-Vision-Based, Tangible-Tokens, Vision-Based","Multi-touch, Tangibility, Touch",Colaboração presencial,EventTable + Multi-touch,,10.1007/978-3-642-23771-3_16
,Towards Utopia: designing tangibles for learning,2011,ACM Digital Library,Study describing digital tabletop application that mentions the hardware used,Accepted,Embedded,"Tangible-Tokens, Vision-Based","Multi-touch, Tangibility, Touch",Colaboração presencial,,,10.1145/1999030.1999032
,"Lessons learned from the WILD room, a multisurface interactive environment",2011,ACM Digital Library,Study describing digital tabletop application that mentions the hardware used,Accepted,Embedded,Sensor-Assisted-Vision-Based,"Multi-touch, Touch",Colaboração presencial,IntuiFace multitouch,45”,10.1145/2044354.2044376
,Hand gesture interaction using color-based method for tabletop interfaces,2011,IEEE Digital Library,Study describing digital tabletop techniques,Accepted,Front-Projected,Vision-Based,"Gesture, Touch",Usuário único,,,10.1109/WISP.2011.6051717
,Interactive multi-user video retrieval systems,2011,Springer Link,Study describing digital tabletop application that mentions the hardware used,Accepted,Embedded,"Sensor-Assisted-Vision-Based, Vision-Based","Multi-touch, Touch",Colaboração presencial,,,10.1007/s11042-011-0888-9
,Hyperinteractive Evolutionary Computation,2011,IEEE Digital Library,Study describing digital tabletop application that mentions the hardware used,Accepted,Embedded,Electrical-Based,"Multi-touch, Touch",Colaboração presencial,Asus Eee Top,,10.1109/TEVC.2010.2096539
,AGORAS: Exploring Creative Learning on Tangible User Interfaces,2011,IEEE Digital Library,Study describing digital tabletop application that mentions the hardware used,Accepted,Embedded,Electrical-Based,"Multi-touch, Touch",Colaboração presencial,,,10.1109/COMPSAC.2011.50
,"RealTimeChess: lessons from a participatory design process for a collaborative multi-touch, multi-user game",2011,ACM Digital Library,Study describing digital tabletop application that mentions the hardware used,Accepted,Front-Projected,Electrical-Based,"Multi-touch, Touch",Colaboração presencial,DiamondTouch,42”,10.1145/2076354.2076374
,Mojo iCuisine: The Design and Implementation of an Interactive Restaurant Tabletop Menu,2011,Springer Link,Study describing digital tabletop techniques,Accepted,Front-Projected,Electrical-Based,Touch,Colaboração presencial,,,10.1007/978-3-642-21616-9_21
,Firestorm: a brainstorming application for collaborative group work at tabletops,2011,ACM Digital Library,Study describing digital tabletop application that mentions the hardware used,Accepted,Embedded,Electrical-Based,"Multi-touch, Touch",Colaboração presencial,,46”,10.1145/2076354.2076386
,Supporting air traffic control collaboration with a TableTop system,2011,ACM Digital Library,Study describing digital tabletop application that mentions the hardware used,Accepted,Front-Projected,Electrical-Based,"Multi-touch, Touch",Colaboração presencial,DiamondTouch,42”,10.1145/1958824.1958891
,Research on the tangible tabletop interaction system based on the optical sensors,2011,Scopus,Study describing digital tabletop techniques,Accepted,Embedded,"Sensor-Assisted-Vision-Based, Tangible-Tokens, Vision-Based","Tangibility, Touch",Colaboração presencial,,,10.1117/12.904760
,Dimensions of collaboration on a tabletop interface for children with autism spectrum disorder,2011,ACM Digital Library,Study describing digital tabletop application that mentions the hardware used,Accepted,Front-Projected,Electrical-Based,"Multi-touch, Touch",Colaboração presencial,DiamondTouch,42”,10.1145/1978942.1979431
,The effects of interaction techniques on talk patterns in collaborative peer learning around interactive tables,2011,ACM Digital Library,Study evaluating digital tabletop techniques,Accepted,Rear-Projected,Sensor-Assisted-Vision-Based,"Multi-touch, Touch",Colaboração presencial,,56.5”,10.1145/1978942.1979393
,Adaptive personal territories for co-located tabletop interaction in a museum setting,2011,ACM Digital Library,Study describing digital tabletop techniques,Accepted,Embedded,Sensor-Assisted-Vision-Based,"Multi-touch, Touch",Colaboração presencial,,"65""",10.1145/2076354.2076375
,ZeroN: mid-air tangible interaction enabled by computer controlled magnetic levitation,2011,ACM Digital Library,Study describing digital tabletop techniques,Accepted,"Rear-Projected, Front-Projected","Sensor-Assisted-Vision-Based, Tangible-Tokens, Vision-Based","Gesture, Tangibility",Colaboração presencial,,,10.1145/2047196.2047239
,"uMeeting, an Efficient Co-located Meeting System on the Large-Scale Tabletop",2011,Springer Link,Study describing digital tabletop application that mentions the hardware used,Accepted,Rear-Projected,Sensor-Assisted-Vision-Based,"Multi-touch, Touch",Colaboração presencial,uTable,169”,10.1007/978-3-642-21619-0_46
,Rethinking 'Multi-user': An in-the-wild study of how groups approach a walk-up-and-use tabletop interface,2011,Scopus,Study describing digital tabletop application that mentions the hardware used,Accepted,Rear-Projected,"Sensor-Assisted-Vision-Based, Vision-Based","Multi-touch, Touch",Colaboração presencial,Microsoft Surface,30”,10.1145/1978942.1979392
,The design of t-vote: a tangible tabletop application supporting children's decision making,2011,ACM Digital Library,Study describing digital tabletop application that mentions the hardware used,Accepted,Embedded,Electrical-Based,Multi-touch,Colaboração presencial,,,10.1145/1999030.1999056
,"""Dinner Party"" sociable interfaces in a tabletop art project",2011,ACM Digital Library,Study describing digital tabletop application that mentions the hardware used,Accepted,Rear-Projected,"Sensor-Assisted-Vision-Based, Vision-Based",Tangibility,Usuário único,,,10.1145/1963564.1963617
,The music pattern: A creative tabletop music creation platform,2011,ACM Digital Library,Study describing digital tabletop techniques,Accepted,Rear-Projected,Sensor-Assisted-Vision-Based,"Multi-touch, Touch",Colaboração presencial,,,10.1145/1899687.1899695
,Subject-Oriented Elicitation of Distributed Business Process Knowledge,2011,Springer Link,Study describing digital tabletop application that mentions the hardware used,Accepted,Rear-Projected,"Tangible-Tokens, Vision-Based",Tangibility,Colaboração presencial,,,10.1007/978-3-642-23471-2_2
,Effects of a Tabletop Interface on the Co-construction of Concept Maps,2011,Springer Link,Study describing digital tabletop techniques,Accepted,Rear-Projected,"Tangible-Tokens, Vision-Based",Tangibility,Colaboração presencial,,50”,10.1007/978-3-642-23765-2_31
,Tangible bots: interaction with active tangibles in tabletop interfaces,2011,ACM Digital Library,Study describing digital tabletop application that mentions the hardware used,Accepted,Rear-Projected,"Sensor-Assisted-Vision-Based, Tangible-Tokens, Vision-Based","Multi-touch, Tangibility",Colaboração presencial,,,10.1145/1978942.1979384
,"uTable: a seamlessly tiled, very large interactive tabletop system",2011,ACM Digital Library,Study describing digital tabletop techniques,Accepted,Rear-Projected,Sensor-Assisted-Vision-Based,"Multi-touch, Touch",Colaboração presencial,uTable,169”,10.1145/2076354.2076397
,Arrange-A-Space: tabletop interfaces and gender collaboration,2011,ACM Digital Library,Study describing digital tabletop application that mentions the hardware used,Accepted,Front-Projected,Electrical-Based,"Multi-touch, Touch",Colaboração presencial,DiamondTouch,42”,10.1145/1979742.1979797
,Beyond one-size-fits-all: how interactive tabletops support collaborative learning,2011,ACM Digital Library,Study describing digital tabletop application that mentions the hardware used,Accepted,Front-Projected,Electrical-Based,"Multi-touch, Touch",Colaboração presencial,DiamondTouch,42”,10.1145/1999030.1999043
,Effects of Viewing Conditions and Rotation Methods in a Collaborative Tabletop AR Environment,2011,IEEE Digital Library,Study evaluating digital tabletop techniques,Accepted,Headset,"Sensor-Assisted-Vision-Based, Tangible-Tokens, Vision-Based",Tangibility,Colaboração presencial,,,10.1109/TVCG.2011.49
,Enhancing genomic learning through tabletop interaction,2011,ACM Digital Library,Study describing digital tabletop application that mentions the hardware used,Accepted,Rear-Projected,"Sensor-Assisted-Vision-Based, Vision-Based","Multi-touch, Touch",Colaboração presencial,Microsoft Surface,30”,10.1145/1978942.1979361
,PuzzleTale: A tangible puzzle game for interactive storytelling,2011,ACM Digital Library,Study describing digital tabletop techniques,Accepted,Front-Projected,"Sensor-Assisted-Vision-Based, Tangible-Tokens",Tangibility,Colaboração presencial,,,10.1145/1899687.1899693
,Exploring How Tangible Tools Enable Collaboration in a Multi-touch Tabletop Game,2011,Springer Link,Study describing digital tabletop application that mentions the hardware used,Accepted,Rear-Projected,"Sensor-Assisted-Vision-Based, Tangible-Tokens, Vision-Based","Multi-touch, Tangibility, Touch",Colaboração presencial,EventTable + Multi-touch,,10.1007/978-3-642-23771-3_45
,A Tabletop-Based Real-World-Oriented Interface,2011,Springer Link,Study describing digital tabletop techniques,Accepted,Front-Projected,"Sensor-Assisted-Vision-Based, Vision-Based",Touch,Usuário único,,,10.1007/978-3-642-21605-3_15
,Usability of technology supported social competence training for children on the Autism Spectrum,2011,IEEE Digital Library,Study describing digital tabletop application that mentions the hardware used,Accepted,Front-Projected,Electrical-Based,"Multi-touch, Touch",Colaboração presencial,DiamondTouch,42”,10.1109/ICVR.2011.5971867
,Hyakunin-Eyesshu: a tabletop Hyakunin-Isshu game with computer opponent by the action prediction based on gaze detection,2011,ACM Digital Library,Study describing digital tabletop techniques,Accepted,Front-Projected,"Eye-Tracking, Sensor-Assisted-Vision-Based, Vision-Based","Gaze, Multi-touch, Touch",Usuário único,,,10.1145/1983302.1983307
,onNote: playing printed music scores as a musical instrument,2011,ACM Digital Library,Study describing digital tabletop application that mentions the hardware used,Accepted,Front-Projected,Vision-Based,Tangibility,Usuário único,,,10.1145/2047196.2047249
,Three around a Table: The Facilitator Role in a Co-located Interface for Social Competence Training of Children with Autism Spectrum Disorder,2011,Springer Link,Study describing digital tabletop application that mentions the hardware used,Accepted,Front-Projected,Electrical-Based,"Multi-touch, Touch",Colaboração presencial,DiamondTouch,42”,10.1007/978-3-642-23771-3_11
,A slim hybrid multi-touch tabletop interface with a high definition LED display and multiple cameras,2012,Scopus,Study describing digital tabletop techniques,Accepted,Embedded,"Sensor-Assisted-Vision-Based, Vision-Based","Multi-touch, Touch",Colaboração presencial,,"47""",10.1109/ICCE.2012.6161836
,A Tabletop Board Game Interface for Multi-user Interaction with a Storytelling System,2012,Springer Link,Study describing digital tabletop application that mentions the hardware used,Accepted,Front-Projected,"Sensor-Assisted-Vision-Based, Tangible-Tokens, Vision-Based","Multi-touch, Tangibility, Touch",Colaboração presencial,,,10.1007/978-3-642-30214-5_14
,Tangible interactions on a flat panel display using actuated paper sheets,2012,ACM Digital Library,Study describing digital tabletop techniques,Accepted,Embedded,"Tangible-Tokens, Vision-Based",Tangibility,Usuário único,,,10.1145/2396636.2396698
,Tabletop games for photo consumption at theme parks,2012,ACM Digital Library,Study describing digital tabletop application that mentions the hardware used,Accepted,Embedded,Electrical-Based,Touch,Colaboração presencial,,"50""",10.1145/2396636.2396646
,Semiautomatic and User-Centered Orientation of Digital Artifacts on Multi-touch Tabletops,2012,Springer Link,Study describing digital tabletop application that mentions the hardware used,Accepted,Rear-Projected,"Sensor-Assisted-Vision-Based, Vision-Based","Multi-touch, Touch",Colaboração presencial,,83”,10.1007/978-3-642-33542-6_34
,StoryCrate: Tabletop storyboarding for live film production,2012,Scopus,Study describing digital tabletop techniques,Accepted,Rear-Projected,"Sensor-Assisted-Vision-Based, Tangible-Tokens, Vision-Based",Tangibility,Usuário único,StoryCrate,65”,10.1145/2207676.2207700
,Understanding designer brainstorms: the effect of analog and digital interfaces on dominance,2012,ACM Digital Library,Study evaluating digital tabletop techniques,Accepted,Front-Projected,Electrical-Based,"Multi-touch, Touch",Colaboração presencial,DiamondTouch,42”,10.1145/2212776.2223659
,"Touch, click, navigate: comparing tabletop and desktop interaction for map navigation tasks",2012,ACM Digital Library,Study evaluating digital tabletop techniques,Accepted,Rear-Projected,"Sensor-Assisted-Vision-Based, Vision-Based","Multi-touch, Touch",Colaboração presencial,Microsoft Surface,30”,10.1145/2396636.2396669
,Exploring tabletops as an effective tool to foster creativity traits,2012,ACM Digital Library,Study evaluating digital tabletop techniques,Accepted,Rear-Projected,"Sensor-Assisted-Vision-Based, Tangible-Tokens, Vision-Based","Multi-touch, Tangibility, Touch",Colaboração presencial,Microsoft Surface + Tangibles,30”,10.1145/2148131.2148163
,Tangible and Wearable User Interfaces for Supporting Collaboration among Emergency Workers,2012,Springer Link,Study describing digital tabletop application that mentions the hardware used,Accepted,Embedded,"Sensor-Assisted-Vision-Based, Tangible-Tokens, Vision-Based, Wearables","Multi-touch, Tangibility, Touch",Colaboração presencial,MultiTaction MT550 + Wearable,"55""",10.1007/978-3-642-33284-5_18
,Tangible 3D tabletops: Combining tangible tabletop interaction and 3D projection,2012,Scopus,Study describing digital tabletop techniques,Accepted,"Rear-Projected, Front-Projected","Tangible-Tokens, Vision-Based",Tangibility,Colaboração presencial,,53”,10.1145/2399016.2399033
,TinkerLamp 2.0: Designing and Evaluating Orchestration Technologies for the Classroom,2012,Springer Link,Study describing digital tabletop techniques,Accepted,Front-Projected,"Tangible-Tokens, Vision-Based",Tangibility,Colaboração presencial,TinkerLamp 2.0,,10.1007/978-3-642-33263-0_6
,ARmy: A study of multi-user interaction in spatially augmented games,2012,IEEE Digital Library,Study describing digital tabletop techniques,Accepted,Front-Projected,Vision-Based,Tangibility,Colaboração presencial,,,10.1109/CVPRW.2012.6239198
,Jamming user interfaces: programmable particle stiffness and sensing for malleable and shape-changing devices,2012,ACM Digital Library,Study describing digital tabletop techniques,Accepted,Rear-Projected,Sensor-Assisted-Vision-Based,"Multi-touch, Tangibility, Touch",Usuário único,,,10.1145/2380116.2380181
,Harnessing the benefits of bimanual and multi-finger input for supporting grouping tasks on interactive tabletops,2012,ACM Digital Library,Study evaluating digital tabletop techniques,Accepted,Rear-Projected,"Sensor-Assisted-Vision-Based, Vision-Based","Multi-touch, Touch",Colaboração presencial,Microsoft Surface,30”,10.1145/2399016.2399091
,Tisch digital tools supporting board games,2012,Scopus,Study describing digital tabletop application that mentions the hardware used,Accepted,Rear-Projected,"Sensor-Assisted-Vision-Based, Vision-Based","Multi-touch, Touch",Colaboração presencial,Microsoft Surface,30”,10.1145/2282338.2282376
,Co-Located Collaborative Visual Analytics around a Tabletop Display,2012,IEEE Digital Library,Study describing digital tabletop application that mentions the hardware used,Accepted,Rear-Projected,"Sensor-Assisted-Vision-Based, Vision-Based","Multi-touch, Touch",Colaboração presencial,Microsoft Surface,30”,10.1109/TVCG.2011.287
,Group interaction on interactive multi-touch tables by children in India,2012,ACM Digital Library,Study evaluating digital tabletop techniques,Accepted,Rear-Projected,Sensor-Assisted-Vision-Based,Multi-touch,Colaboração presencial,,50”,10.1145/2307096.2307131
,Personal assistant agents and multi-agent middleware for CSCW,2012,IEEE Digital Library,Study describing digital tabletop application that mentions the hardware used,Accepted,Embedded,"Sensor-Assisted-Vision-Based, Vision-Based","Multi-touch, Touch",Colaboração presencial,,,10.1109/CSCWD.2012.6221800
,Occlusion-aware interaction techniques for tabletop systems,2012,ACM Digital Library,Study describing digital tabletop application that mentions the hardware used,Accepted,Rear-Projected,"Sensor-Assisted-Vision-Based, Vision-Based","Multi-touch, Touch",Colaboração presencial,,46”,10.1145/2212776.2223831
,At home with surface computing?,2012,ACM Digital Library,Study describing digital tabletop techniques,Accepted,Embedded,Electrical-Based,"Multi-touch, Touch",Colaboração presencial,,,10.1145/2207676.2207699
,PapARt: Interactive 3D graphics and multi-touch augmented paper for artistic creation,2012,IEEE Digital Library,Study describing digital tabletop techniques,Accepted,Front-Projected,"Pen, Sensor-Assisted-Vision-Based, Vision-Based","Gesture, Multi-touch, Tangibility, Touch",Usuário único,,,10.1109/3DUI.2012.6184167
,Supporting opportunistic search in meetings with tangible tabletop,2012,ACM Digital Library,Study describing digital tabletop application that mentions the hardware used,Accepted,Front-Projected,"Pen, Sensor-Assisted-Vision-Based","Speech, Tangibility",Colaboração presencial,TinkerLamp,,10.1145/2212776.2223837
,Interacting with mouse and touch devices on horizontal interactive displays,2012,Scopus,Study evaluating digital tabletop techniques,Accepted,Embedded,Sensor-Assisted-Vision-Based,Touch,Colaboração presencial,[braccetto] research platform,46’’,10.1007/s10209-011-0238-8
