title,year,source,selection_criteria,status,comments
ISS Companion '23: Companion Proceedings of the 2023 Conference on Interactive Surfaces and Spaces,2023,ACM Digital Library,"Incomplete works, posters, summaries",Rejected,
[WORKSHOP] Radical Alternate Futurescoping: Solarpunk versus Grimdark,2023,ACM Digital Library,"Incomplete works, posters, summaries",Rejected,
Tangibles for Health Workshop,2016,ACM Digital Library,"Incomplete works, posters, summaries",Rejected,
Designing Tangibles for Children: One Day Hands-on Workshop,2016,ACM Digital Library,"Incomplete works, posters, summaries",Rejected,
Experiencing interactivity in public spaces (eips),2013,ACM Digital Library,"Incomplete works, posters, summaries",Rejected,
TUIO Hackathon,2014,ACM Digital Library,"Incomplete works, posters, summaries",Rejected,
CHI PLAY '22: Extended Abstracts of the 2022 Annual Symposium on Computer-Human Interaction in Play,2022,ACM Digital Library,"Incomplete works, posters, summaries",Rejected,
UIST '23: Proceedings of the 36th Annual ACM Symposium on User Interface Software and Technology,2023,ACM Digital Library,"Incomplete works, posters, summaries",Rejected,
IDC '23: Proceedings of the 22nd Annual ACM Interaction Design and Children Conference,2023,ACM Digital Library,"Incomplete works, posters, summaries",Rejected,
Tangible play: research and design for tangible and tabletop games,2007,ACM Digital Library,"Incomplete works, posters, summaries",Rejected,
Shared Infrastructures for Tangible Tabletops Interactive Surfaces,2015,ACM Digital Library,"Incomplete works, posters, summaries",Rejected,
Active Tangibles for Tabletop Interaction based on the Kniwwelino Prototyping Platform,2019,ACM Digital Library,"Incomplete works, posters, summaries",Rejected,
Weaving Fire into Form: Aspirations for Tangible and Embodied Interaction,2022,ACM Digital Library,"Incomplete works, posters, summaries",Rejected,
"TEI '24: Proceedings of the Eighteenth International Conference on Tangible, Embedded, and Embodied Interaction",2024,ACM Digital Library,"Incomplete works, posters, summaries",Rejected,
"TEI '25: Proceedings of the Nineteenth International Conference on Tangible, Embedded, and Embodied Interaction",2025,ACM Digital Library,"Incomplete works, posters, summaries",Rejected,
Theme issue on EIST,2013,Springer Link,"Incomplete works, posters, summaries",Rejected,
Knowledge Net: Fostering Children’s Understanding of Knowledge Representations Through Creative Making and Embodied Interaction in a Museum Exhibit,2024,ACM Digital Library,"Incomplete works, posters, summaries",Rejected,
"Human-Computer Interaction: Interaction Platforms and Techniques - 12th International Conference, HCI International 2007, Proceedings",2007,Scopus,"Incomplete works, posters, summaries",Rejected,
Evaluation of an Interactive Computer-Enabled Tabletop Learning Tool for Children with Special Needs,2023,Scopus,Interfaces with only mouse/keyboard interaction,Rejected,
Combining Shape-Changing Interfaces and Spatial Augmented Reality Enables Extended Object Appearance,2016,ACM Digital Library,Interfaces with only mouse/keyboard interaction,Rejected,Não tem como interagir 
Depth-Sensing Video Cameras for 3D Tangible Tabletop Interaction,2007,IEEE Digital Library,Interfaces with only mouse/keyboard interaction,Rejected,"Não da pra interagir direto com a mesa, apenas através de joystick"
"Roles of Orientation in Tabletop Collaboration: Comprehension, Coordination and Communication",2004,Springer Link,Interfaces with only mouse/keyboard interaction,Rejected,
Designing Technology for Shared Communication and Awareness in Wilderness Search and Rescue,2020,Springer Link,Interfaces with only mouse/keyboard interaction,Rejected,A mesa não possui nenhuma forma de detectar interação direta.
Wearable Augmented Reality System Using Head-Mounted Projector,2021,Springer Link,Interfaces with only mouse/keyboard interaction,Rejected,Não tem como interagir com a projeção
A comparative ergonomics study: Performing reading-based tasks on a large-scale tabletop vs. laptop,2012,Science@Direct,Interfaces with only mouse/keyboard interaction,Rejected,O artigo não parece descrever interação
Collaboration between Tabletop and Mobile Device,2011,IEEE Digital Library,Interfaces with only mouse/keyboard interaction,Rejected,"Não tem como interagir direto com a tabletop, só através de outros dispositivos"
Parameterization of sharable display area to reproduce appropriate glasses-free tabletop 3-D images,2012,IEEE Digital Library,Interfaces with only mouse/keyboard interaction,Rejected,Não tem como interagir com essa tabletop
A study of hand shape use in tabletop gesture interaction,2006,ACM Digital Library,Interfaces with only mouse/keyboard interaction,Rejected,A interface não tem input
Magic desk: bringing multi-touch surfaces into desktop work,2011,ACM Digital Library,Interfaces with only mouse/keyboard interaction,Rejected,
The Haptic Tabletop Puck: tactile feedback for interactive tabletops,2009,ACM Digital Library,Interfaces with only mouse/keyboard interaction,Rejected,
Chemieraum: tangible chemistry in exhibition space,2009,ACM Digital Library,Interfaces with only mouse/keyboard interaction,Rejected,
The effects of tactile feedback and movement alteration on interaction and awareness with digital embodiments,2013,ACM Digital Library,Interfaces with only mouse/keyboard interaction,Rejected,
Recognition of Paper-Based Conceptual Models Captured Under Uncontrolled Conditions,2017,IEEE Digital Library,The digital tabletop interface was not tangible,Rejected,"É um sistema que analisa uma tabletop analogica, processa os dados, mas não tem display na mesa pro usuário"
Mirrortablet: exploring a low-cost mobile system for capturing unmediated hand gestures in remote collaboration,2017,ACM Digital Library,The digital tabletop interface was not tangible,Rejected,Não é de tabletop
Block Talks: A Tangible and Augmented Reality Toolkit for Children to Learn Sentence Construction,2018,ACM Digital Library,The digital tabletop interface was not tangible,Rejected,"Não é sobre tabletop, usa AR em mobile"
BrickMusicTable: A LEGO brick-based tabletop sequencer,2024,ACM Digital Library,The digital tabletop interface was not tangible,Rejected,Não tem display
Clutch & Grasp: Activation gestures and grip styles for device-based interaction in medical spatial augmented reality,2023,Science@Direct,The digital tabletop interface was not tangible,Rejected,Não é sobre tabletop
Designing Tangible Tools to Engage Silent Students in Group Discussion,2022,IEEE Digital Library,The digital tabletop interface was not tangible,Rejected,Não é sobre tabletop
A Collaborative Platform Supporting Distributed Teams in Visualization and Analysis of Infectious Disease Data,2022,IEEE Digital Library,The digital tabletop interface was not tangible,Rejected,Não é sobre tabletop
Activities of Daily Living-Based Rehabilitation System for Arm and Hand Motor Function Retraining After Stroke,2022,IEEE Digital Library,The digital tabletop interface was not tangible,Rejected,Não é sobre tabletop
CollaboVR: A Reconfigurable Framework for Creative Collaboration in Virtual Reality,2020,IEEE Digital Library,The digital tabletop interface was not tangible,Rejected,Não é sobre tabletop
Songverse: A Music-Loop Authoring Tool Based on Virtual Reality,2019,IEEE Digital Library,The digital tabletop interface was not tangible,Rejected,Não é sobre tabletop
Worlds-in-Wedges: Combining Worlds-in-Miniature and Portals to Support Comparative Immersive Visualization of Forestry Data,2019,IEEE Digital Library,The digital tabletop interface was not tangible,Rejected,Não é sobre tabletop
A GIS Based Disaster Status Sharing and Representation System Using Ultra Definition Display Environment,2014,IEEE Digital Library,The digital tabletop interface was not tangible,Rejected,Display vertical
Learning for Sustainable Organisational Interoperability,2014,Science@Direct,The digital tabletop interface was not tangible,Rejected,Não é sobre tabletop
Synchronized and efficient communication system based on Agent-Mediator framework for adaptive mixed reality space,2013,IEEE Digital Library,The digital tabletop interface was not tangible,Rejected,Não é sobre tabletop
Communicating Personal Genomic Information to Non-experts: A New Frontier for Human-Computer Interaction,2017,IEEE Digital Library,The digital tabletop interface was not tangible,Rejected,Não é sobre tabletop
Embedded Unit for Point-of-Care Impedance Based Biosensor Readout,2012,IEEE Digital Library,The digital tabletop interface was not tangible,Rejected,Não é sobre tabletop
A proposal for an experimental platform on Collaborative Information Retrieval,2009,IEEE Digital Library,The digital tabletop interface was not tangible,Rejected,Não é sobre tabletop
On SPAWC: Discussion on a Musical Signal Parser and Well-Formed Composer,2009,IEEE Digital Library,The digital tabletop interface was not tangible,Rejected,Não é um tabletop
Chores are fun: Understanding social play in board games for digital tabletop game design,2011,Scopus,The digital tabletop interface was not tangible,Rejected,Tabletop analogica com display vertical auxiliar
Development of a Tangible Learning System that Supports Role-Play Simulation and Reflection by Playing Puppet Shows,2017,Springer Link,The digital tabletop interface was not tangible,Rejected,Não possui display com feedback pro usuário
Orchestrating tangible music interfaces for in-classroom music learning through a fairy tale: The case of ImproviSchool,2017,Springer Link,The digital tabletop interface was not tangible,Rejected,
BotBar: A Platform for Multi-disciplinary Design Education,2016,Springer Link,The digital tabletop interface was not tangible,Rejected,
Bringing tabletop technology to all: evaluating a tangible farm game with kindergarten and special needs children,2012,Springer Link,The digital tabletop interface was not tangible,Rejected,display vertical
Affinity Diagramming with a Robot,2024,ACM Digital Library,The digital tabletop interface was not tangible,Rejected,
TASEP: A Collaborative Social Engineering Tabletop Role-Playing Game to Prevent Successful Social Engineering Attacks,2023,ACM Digital Library,The digital tabletop interface was not tangible,Rejected,
"AdHocProx: Sensing Mobile, Ad-Hoc Collaborative Device Formations using Dual Ultra-Wideband Radios",2023,ACM Digital Library,The digital tabletop interface was not tangible,Rejected,
Interacting with Rigid and Soft Surfaces for Smart-Home Control,2022,ACM Digital Library,The digital tabletop interface was not tangible,Rejected,
Understanding Tabletop Games Accessibility: Exploring Board and Card Gaming Experiences of People who are Blind and Low Vision,2022,ACM Digital Library,The digital tabletop interface was not tangible,Rejected,
"A Review of Cognitive Assistants for Healthcare: Trends, Prospects, and Future Directions",2021,ACM Digital Library,The digital tabletop interface was not tangible,Rejected,
FlipMe: Exploring Tangible Peer-to-Peer Communication in On-Line-Learning,2019,ACM Digital Library,The digital tabletop interface was not tangible,Rejected,Display vertical
Smart Toys Design Opportunities for Measuring Children's Fine Motor Skills Development,2018,ACM Digital Library,The digital tabletop interface was not tangible,Rejected,Não tem display digital
Designing with and for Preschoolers: A Method to Observe Tangible Interactions with Spatial Manipulatives,2018,ACM Digital Library,The digital tabletop interface was not tangible,Rejected,"É sobre tabletop analógica, não digital"
Creating a Datascape: a game to support communities in using open data,2017,ACM Digital Library,The digital tabletop interface was not tangible,Rejected,
GestureSeg: developing a gesture segmentation system using gesture execution phase labeling by crowd workers,2016,ACM Digital Library,The digital tabletop interface was not tangible,Rejected,
Design Rationale: Opportunities and Recommendations for Tangible Reading Systems for Children,2016,ACM Digital Library,The digital tabletop interface was not tangible,Rejected,
A laboratory-based study methodology to investigate attraction power of large public interactive displays,2015,ACM Digital Library,The digital tabletop interface was not tangible,Rejected,
Designing motion-based activities to engage students with autism in classroom settings,2015,ACM Digital Library,The digital tabletop interface was not tangible,Rejected,
"""Callout Bubble Saved My Life"": Workspace Awareness Support in BYOD Classrooms",2015,ACM Digital Library,The digital tabletop interface was not tangible,Rejected,
"SoD-Toolkit: A Toolkit for Interactively Prototyping and Developing Multi-Sensor, Multi-Device Environments",2015,ACM Digital Library,The digital tabletop interface was not tangible,Rejected,
Kinetic Blocks: Actuated Constructive Assembly for Interaction and Display,2015,ACM Digital Library,The digital tabletop interface was not tangible,Rejected,
HandSonor: a customizable vision-based control interface for musical expression,2013,ACM Digital Library,The digital tabletop interface was not tangible,Rejected,Display vertical
Investigating attraction and engagement of animation on large interactive walls in public settings,2013,ACM Digital Library,The digital tabletop interface was not tangible,Rejected,Interface e display vertical
YPhone: applying generation y interactions into an office context,2013,ACM Digital Library,The digital tabletop interface was not tangible,Rejected,
Multi-perspective multi-layer interaction on mobile device,2013,ACM Digital Library,The digital tabletop interface was not tangible,Rejected,É sobre dispositivos móveis
DisplayStacks: interaction techniques for stacks of flexible thin-film displays,2012,ACM Digital Library,The digital tabletop interface was not tangible,Rejected,
IAMHear: a tabletop interface with smart mobile devices using acoustic location,2013,ACM Digital Library,The digital tabletop interface was not tangible,Rejected,"Muito não ortodoxa, usa vários celulares pra interface."
GesText: accelerometer-based gestural text-entry systems,2010,ACM Digital Library,The digital tabletop interface was not tangible,Rejected,
What do you bring to the table? investigations of a collaborative workspace,2010,ACM Digital Library,The digital tabletop interface was not tangible,Rejected,
"A Useful Visualization Technique: A Literature Review for Augmented Reality and its Application, limitation &amp; future direction",2009,Springer Link,The digital tabletop interface was not tangible,Rejected,
Swinxsbee: A Shared Interactive Play Object to Stimulate Children’s Social Play Behaviour and Physical Exercise,2009,Springer Link,The digital tabletop interface was not tangible,Rejected,
Creating a Development Support Bubble for Children,2009,Springer Link,The digital tabletop interface was not tangible,Rejected,
Music-Making and Musical Comprehension with Robotic Building Blocks,2009,Springer Link,The digital tabletop interface was not tangible,Rejected,
End-User Software Engineering of Smart Retail Environments: The Intelligent Shop Window,2008,Springer Link,The digital tabletop interface was not tangible,Rejected,
A Test-Driven Approach for Extracting Libraries of Reusable Components from Existing Applications,2011,Springer Link,The digital tabletop interface was not tangible,Rejected,
Narrative Entertainment System with Tabletop Interface,2010,Springer Link,The digital tabletop interface was not tangible,Rejected,
Requirements Sensemaking Using Concept Maps,2012,Springer Link,The digital tabletop interface was not tangible,Rejected,
Connotation in Computational Creativity,2012,Springer Link,The digital tabletop interface was not tangible,Rejected,
MARBOWL: increasing the fun experience of shooting marbles,2011,Springer Link,The digital tabletop interface was not tangible,Rejected,
Development of an Eye-Tracking Pen Display for Analyzing Embodied Interaction,2011,Springer Link,The digital tabletop interface was not tangible,Rejected,Display vertical
Scenarchitectures: The Use of Domain-Specific Architectures to Bridge Design and Implementation,2011,Springer Link,The digital tabletop interface was not tangible,Rejected,
Interaction Analysis as a Tool for Supporting Collaboration: An Overview,2011,Springer Link,The digital tabletop interface was not tangible,Rejected,
Paraplay: Exploring Playfulness Around Physical Console Gaming,2013,Springer Link,The digital tabletop interface was not tangible,Rejected,
A Method for Promoting Interaction Awareness by Biological Rhythm in Elementary School Children,2013,Springer Link,The digital tabletop interface was not tangible,Rejected,
Evaluating Paper Prototype for Tabletop Collaborative Game Applications,2013,Springer Link,The digital tabletop interface was not tangible,Rejected,
Smart-Device-Based Augmented Reality (SDAR) Models to Support Interior Design: Rethinking “Screen” in Augmented Reality,2013,Springer Link,The digital tabletop interface was not tangible,Rejected,
Enabling Interactive Bathroom Entertainment Using Embedded Touch Sensors in the Bathtub,2013,Springer Link,The digital tabletop interface was not tangible,Rejected,"É sobre uma banheira tangível, não uma mesa"
Enhancing Usability Engineering in Rural Areas Using Agile Methods,2014,Springer Link,The digital tabletop interface was not tangible,Rejected,
The Use of Token-Based Protocols in CSCW Tasks – An Empirical Examination,2014,Springer Link,The digital tabletop interface was not tangible,Rejected,
Designing a Digital Experience for Young Children with Developmental Disabilities,2014,Springer Link,The digital tabletop interface was not tangible,Rejected,
A case study of intended versus actual experience of adaptivity in a tangible storytelling system,2013,Springer Link,The digital tabletop interface was not tangible,Rejected,
Collaborative Brainstorming Activity Results and Information Systems,2014,Springer Link,The digital tabletop interface was not tangible,Rejected,Display vertical
"On Feelings of Comfort, Motivation and Joy that GUI and TUI Evoke",2014,Springer Link,The digital tabletop interface was not tangible,Rejected,
On the Interoperability Contributions of S-BPM,2014,Springer Link,The digital tabletop interface was not tangible,Rejected,
Theme issue on designing collaborative interactive spaces,2013,Springer Link,The digital tabletop interface was not tangible,Rejected,
Innovation in Product Engineering,2016,Springer Link,The digital tabletop interface was not tangible,Rejected,
Worlds in the Age of Digital Simulation,2015,Springer Link,The digital tabletop interface was not tangible,Rejected,
More Playful User Interfaces: An Introduction,2015,Springer Link,The digital tabletop interface was not tangible,Rejected,
"An integrated environment and development framework for social gaming using mobile devices, digital TV and Internet",2014,Springer Link,The digital tabletop interface was not tangible,Rejected,
Playful Interfaces: Introduction and History,2014,Springer Link,The digital tabletop interface was not tangible,Rejected,
Remote Collaboration with Spatial AR Support,2014,Springer Link,The digital tabletop interface was not tangible,Rejected,
Tangible or Not Tangible – A Comparative Study of Interaction Types for Process Modeling Support,2014,Springer Link,The digital tabletop interface was not tangible,Rejected,
A 3D Visualization Approach for Process Training in Office Environments,2016,Springer Link,The digital tabletop interface was not tangible,Rejected,
Proposal of an Architecture and Implementation of a Triage Support System,2016,Springer Link,The digital tabletop interface was not tangible,Rejected,
Storyboards as a Lingua Franca in Multidisciplinary Design Teams,2016,Springer Link,The digital tabletop interface was not tangible,Rejected,
Distributed Architecture for Supporting Collaboration,2015,Springer Link,The digital tabletop interface was not tangible,Rejected,Display vertical
Hybrid Games: Designing Tangible Interfaces for Very Young Children and Children with Special Needs,2015,Springer Link,The digital tabletop interface was not tangible,Rejected,display vertical
Augmented Tangible Surfaces to Support Cognitive Games for Ageing People,2015,Springer Link,The digital tabletop interface was not tangible,Rejected,Display vertical
Sound localization on a horizontal surface: virtual and real sound source localization,2015,Springer Link,The digital tabletop interface was not tangible,Rejected,
Cyberlearning Community Report: Emerging Design Themes in US TEL,2017,Springer Link,The digital tabletop interface was not tangible,Rejected,
Designing an Interactive Learning to Enrich Children’s Experience in Museum Visit,2017,Springer Link,The digital tabletop interface was not tangible,Rejected,
Instruments for Spatial Sound Control in Real Time Music Performances. A Review,2016,Springer Link,The digital tabletop interface was not tangible,Rejected,
The design of smart educational environments,2016,Springer Link,The digital tabletop interface was not tangible,Rejected,
Modding Tabletop Games for Education,2019,Springer Link,The digital tabletop interface was not tangible,Rejected,Não é sobre tabletop digital
Playing with Persiflage: The Impact of Free-Form Dialogue on the Play of Computer Role Playing Games,2019,Springer Link,The digital tabletop interface was not tangible,Rejected,
From Design Fiction to Design Fact: Developing Future User Experiences with Proto-Tools,2018,Springer Link,The digital tabletop interface was not tangible,Rejected,
"Sheets 2, 3 and 4 (The Middle Sheets)",2017,Springer Link,The digital tabletop interface was not tangible,Rejected,
Participatory Design of Technology for Inclusive Education: A Case Study,2017,Springer Link,The digital tabletop interface was not tangible,Rejected,n tem display
Computer Music Languages and Systems: The Synergy Between Technology and Creativity,2016,Springer Link,The digital tabletop interface was not tangible,Rejected,
Physical Versus Digital Sticky Notes in Collaborative Ideation,2018,Springer Link,The digital tabletop interface was not tangible,Rejected,"Usa uma Microsoft Surface Hub, que é um digital whiteboard, não um tabletop"
A coherent framework for simultaneous detection and spotting of the nucleus phase from the mid-air gesticulation of alphanumeric keys,2023,Springer Link,The digital tabletop interface was not tangible,Rejected,
Teaching Defence Against the Dark Arts Using Game-Based Learning: A Review of Learning Games for Cybersecurity Education,2020,Springer Link,The digital tabletop interface was not tangible,Rejected,
Turn taking with turn-talk in group: Actions and reflections with children and teachers,2019,Springer Link,The digital tabletop interface was not tangible,Rejected,
M.Integrator: a maker’s tool for integrating kinetic mechanisms and sensors,2019,Springer Link,The digital tabletop interface was not tangible,Rejected,
Technology for Social Change in school contexts: A new landscape for K-12 educational technology research,2018,Springer Link,The digital tabletop interface was not tangible,Rejected,
Special issue on exploring new Natural User Experiences,2017,Springer Link,The digital tabletop interface was not tangible,Rejected,
Tackling developmental delays with therapeutic activities based on tangible tabletops,2017,Springer Link,The digital tabletop interface was not tangible,Rejected,"Display vertical
"
"Designing an Arts-Based, Collaborative Mystery Game to Improve Players’ Motivation and Confidence as Storytellers",2021,Springer Link,The digital tabletop interface was not tangible,Rejected,Menciona um tabletop simulator like
Selfie fundus imaging for diabetic retinopathy screening,2021,Springer Link,The digital tabletop interface was not tangible,Rejected,Menciona uma câmera digital de mesa (Digital tabletop camera)
The Latest Technologies for Mobile Learning,2020,Springer Link,The digital tabletop interface was not tangible,Rejected,mobile
MR Environments Constructed for a Large Indoor Physical Space,2020,Springer Link,The digital tabletop interface was not tangible,Rejected,
"Smart home design flexibility as an enabler of sustainability and the reception in Sulaiymaniah, Kurdistan Region-Iraq",2020,Springer Link,The digital tabletop interface was not tangible,Rejected,
Designing a Smart Toy Interactive Setting for Creating Stories: From Free Play to Story Structure and Reflection Support,2020,Springer Link,The digital tabletop interface was not tangible,Rejected,
Agile Software Tools in the Field: The Need for a Tool Reflection Process,2021,Springer Link,The digital tabletop interface was not tangible,Rejected,
Exploring Current Board Games’ Accessibility Efforts for Persons with Visual Impairment,2021,Springer Link,The digital tabletop interface was not tangible,Rejected,É sobre tabletop games analógicos
What if Social Robots Look for Productive Engagement?: Automated Assessment of Goal-Centric Engagement in Learning Applications,2021,Springer Link,The digital tabletop interface was not tangible,Rejected,
Collaborative Learning Analytics,2021,Springer Link,The digital tabletop interface was not tangible,Rejected,
"Collaborative behavior, performance and engagement with visual analytics tasks using mobile devices",2020,Springer Link,The digital tabletop interface was not tangible,Rejected,mobile
Pivoting to Land Co-Creative AI Tools in Newsrooms,2025,Springer Link,The digital tabletop interface was not tangible,Rejected,Não é sobre tabletop
Cyber Ranges,2025,Springer Link,The digital tabletop interface was not tangible,Rejected,Não é sobre tabletop
