title,year,source,selection_criteria,status,comments
Pen and touch gestural environment for document editing on interactive tabletops,2013,ACM Digital Library,Study describing digital tabletop application that mentions the hardware used,Accepted,
MapTable: a tactical command and control interface,2006,ACM Digital Library,Study describing digital tabletop application that mentions the hardware used,Accepted,
"RoboJockey: real-time, simultaneous, and continuous creation of robot actions for everyone",2010,ACM Digital Library,Study describing digital tabletop application that mentions the hardware used,Accepted,
Exploratory study on concurrent interaction in co-located collaboration,2007,ACM Digital Library,Study describing digital tabletop application that mentions the hardware used,Accepted,
Dynamic Spatial Positioning: Physical Collaboration around Interactive Table by Children in India,2013,Springer Link,Study describing digital tabletop application that mentions the hardware used,Accepted,
Designing reality-based interfaces for experiential bio-design,2013,Springer Link,Study describing digital tabletop application that mentions the hardware used,Accepted,
Table-centric interactive spaces for real-time collaboration,2006,ACM Digital Library,Study describing digital tabletop application that mentions the hardware used,Accepted,
TabletopCars: interaction with active tangible remote controlled cars,2013,ACM Digital Library,Study describing digital tabletop application that mentions the hardware used,Accepted,
Development of a gaze-and-touch algorithm for a tabletop Hyakunin-Isshu game with a computer opponent,2012,IEEE Digital Library,Study describing digital tabletop application that mentions the hardware used,Accepted,
Utilizing Digital Tabletops in Collocated Agile Planning Meetings,2008,IEEE Digital Library,Study describing digital tabletop application that mentions the hardware used,Accepted,
TeamSearch: comparing techniques for co-present collaborative search of digital media,2006,IEEE Digital Library,Study describing digital tabletop application that mentions the hardware used,Accepted,
Fluid integration of rotation and translation,2005,ACM Digital Library,Study describing digital tabletop application that mentions the hardware used,Accepted,
An environment for collaborative iteration planning,2005,Scopus,Study describing digital tabletop application that mentions the hardware used,Accepted,
Designing a user interface for a painting application supporting real watercolor painting processes,2012,ACM Digital Library,Study describing digital tabletop application that mentions the hardware used,Accepted,
Tabletop games for photo consumption at theme parks,2012,ACM Digital Library,Study describing digital tabletop application that mentions the hardware used,Accepted,
G-nome surfer: a tabletop interface for collaborative exploration of genomic data,2010,ACM Digital Library,Study describing digital tabletop application that mentions the hardware used,Accepted,
Read-It: five-to-seven-year-old children learn to read in a tabletop environment,2004,ACM Digital Library,Study describing digital tabletop application that mentions the hardware used,Accepted,
Exploring Interactions with Tangible and Actuated Tokens on a Shared Tabletop for Railway Traffic Management Control Centres,2025,ACM Digital Library,Study describing digital tabletop application that mentions the hardware used,Accepted,https://hal.science/hal-04830460v1/document
BacPack for New Frontiers: A Tangible Tabletop Museum Exhibit Exploring Synthetic Biology,2016,ACM Digital Library,Study describing digital tabletop application that mentions the hardware used,Accepted,
Fighting for control: children's embodied interactions when using physical and digital representations,2009,ACM Digital Library,Study describing digital tabletop application that mentions the hardware used,Accepted,
Turning the tables: an interactive surface for vjing,2009,ACM Digital Library,Study describing digital tabletop application that mentions the hardware used,Accepted,
Children designing together on a multi-touch tabletop: an analysis of spatial orientation and user interactions,2009,ACM Digital Library,Study describing digital tabletop application that mentions the hardware used,Accepted,
Mapping Place: Supporting Cultural Learning through a Lukasa-inspired Tangible Tabletop Museum Exhibit,2015,ACM Digital Library,Study describing digital tabletop application that mentions the hardware used,Accepted,
Tangible bots: interaction with active tangibles in tabletop interfaces,2011,ACM Digital Library,Study describing digital tabletop application that mentions the hardware used,Accepted,
Transforming Lives Through Story Immersion: Innovation of Aphasia Rehabilitation Therapy through Storytelling Learning Landscapes,2014,ACM Digital Library,Study describing digital tabletop application that mentions the hardware used,Accepted,
Supporting medical conversations between deaf and hearing individuals with tabletop displays,2008,ACM Digital Library,Study describing digital tabletop application that mentions the hardware used,Accepted,
Cooperative gestures: multi-user gestural interactions for co-located groupware,2006,ACM Digital Library,Study describing digital tabletop application that mentions the hardware used,Accepted,
Distributed tabletops: territoriality and orientation in distributed collaboration,2007,ACM Digital Library,Study describing digital tabletop application that mentions the hardware used,Accepted,
Beyond one-size-fits-all: how interactive tabletops support collaborative learning,2011,ACM Digital Library,Study describing digital tabletop application that mentions the hardware used,Accepted,
A co-located interface for narration to support reconciliation in a conflict: initial results from Jewish and Palestinian youth,2008,ACM Digital Library,Study describing digital tabletop application that mentions the hardware used,Accepted,
Collaborative Puzzle Game: a tabletop interactive game for fostering collaboration in children with Autism Spectrum Disorders (ASD),2009,ACM Digital Library,Study describing digital tabletop application that mentions the hardware used,Accepted,
Designing and evaluating the tabletop game experience for senior citizens,2008,ACM Digital Library,Study describing digital tabletop application that mentions the hardware used,Accepted,
What caused that touch? expressive interaction with a surface through fiduciary-tagged gloves,2010,ACM Digital Library,Study describing digital tabletop application that mentions the hardware used,Accepted,Microsoft surface
A collaborative design graphical tool based on Interactive Spaces and Natural Interfaces: A case study on an international design project,2014,IEEE Digital Library,Study describing digital tabletop application that mentions the hardware used,Accepted,
Sharing and building digital group histories,2002,ACM Digital Library,Study describing digital tabletop application that mentions the hardware used,Accepted,
Trajectories of Physical Engagement and Expression in a Co-Creative Museum Installation,2019,ACM Digital Library,Study describing digital tabletop application that mentions the hardware used,Accepted,
Exploring Genetic Mutations on Mitochondrial DNA Cancer Data with Interactive Tabletop and Active Tangibles,2016,ACM Digital Library,Study describing digital tabletop application that mentions the hardware used,Accepted,
"RealTimeChess: lessons from a participatory design process for a collaborative multi-touch, multi-user game",2011,ACM Digital Library,Study describing digital tabletop application that mentions the hardware used,Accepted,
The Effect of View Techniques on Collaboration and Awareness in Tabletop Map-Based Tasks,2014,ACM Digital Library,Study describing digital tabletop application that mentions the hardware used,Accepted,
A multimodal approach to examining 'embodiment' in tangible learning environments,2013,ACM Digital Library,Study describing digital tabletop application that mentions the hardware used,Accepted,
"Shallow-depth 3d interaction: design and evaluation of one-, two- and three-touch techniques",2007,ACM Digital Library,Study describing digital tabletop application that mentions the hardware used,Accepted,
Co-Located Collaborative Visual Analytics around a Tabletop Display,2012,IEEE Digital Library,Study describing digital tabletop application that mentions the hardware used,Accepted,
onNote: playing printed music scores as a musical instrument,2011,ACM Digital Library,Study describing digital tabletop application that mentions the hardware used,Accepted,
aMAZEd: designing an affective social game for children,2007,ACM Digital Library,Study describing digital tabletop application that mentions the hardware used,Accepted,
It's just a toolbar! using tangibles to help children manage conflict around a multi-touch tabletop,2010,ACM Digital Library,Study describing digital tabletop application that mentions the hardware used,Accepted,microsoft surface
Exploring How a Co-dependent Tangible Tool Design Supports Collaboration in a Tabletop Activity,2014,ACM Digital Library,Study describing digital tabletop application that mentions the hardware used,Accepted,
Investigating Paradigms of Group Territory in Multiple Display Environments,2020,ACM Digital Library,Study describing digital tabletop application that mentions the hardware used,Accepted, 55’ Microsoft multi-touch display
"BIM4VET, Towards BIM Training Recommendation for AEC Professionals",2018,Springer Link,Study describing digital tabletop application that mentions the hardware used,Accepted,
Interfering and resolving: How tabletop interaction facilitates co-construction of argumentative knowledge,2010,Springer Link,Study describing digital tabletop techniques,Accepted,
Tangible Map: Designing and Assessing Spatial Information Retrieval Through a Tactile Interface,2019,Springer Link,Study describing digital tabletop techniques,Accepted,
Supporting casual interactions between board games on public tabletop displays and mobile devices,2009,Scopus,Study describing digital tabletop techniques,Accepted,
Poster: Overtop: Breaking the boundaries of tangible tabletop environments,2018,Scopus,Study describing digital tabletop techniques,Accepted,
StoryCrate: Tabletop storyboarding for live film production,2012,Scopus,Study describing digital tabletop techniques,Accepted,
TAPAS: A tangible End-User Development tool supporting the repurposing of Pervasive Displays,2017,Science@Direct,Study describing digital tabletop techniques,Accepted,
Construction defect management using a telematic digital workbench,2009,Science@Direct,Study describing digital tabletop techniques,Accepted,
StoryGrid [educational computing],2005,IEEE Digital Library,Study describing digital tabletop techniques,Accepted,
Interactive Tree Comparison for Co-located Collaborative Information Visualization,2007,IEEE Digital Library,Study describing digital tabletop techniques,Accepted,
SpiroSurface: A Repulsive and Attractive Force Display for Interactive Tabletops Using a Pneumatic System,2018,IEEE Digital Library,Study describing digital tabletop techniques,Accepted,
"StorySpace: technology supporting reflection, expression, and discourse in classroom narrative",2004,IEEE Digital Library,Study describing digital tabletop techniques,Accepted,
Nervixxx: A Video Performance System with Neural Interfaces,2009,IEEE Digital Library,Study describing digital tabletop techniques,Accepted,
Calibration on Co-located Ad-Hoc Multi Mobile System,2016,ACM Digital Library,Study describing digital tabletop techniques,Accepted,
PATI: a projection-based augmented table-top interface for robot programming,2019,ACM Digital Library,Study describing digital tabletop techniques,Accepted,
MobiTop: Interactivity Issues in a Multi-Mobile System,2016,ACM Digital Library,Study describing digital tabletop techniques,Accepted,
The Hyper Drumhead: A Musical Instrument For The Audio/Visual Manipulation Of Sound Waves,2022,ACM Digital Library,Study describing digital tabletop techniques,Accepted,Na descrição tem a info https://youtu.be/_qLwJC4PYR0
Multimodal Segmentation on a Large Interactive Tabletop: Extending Interaction on Horizontal Surfaces with Gaze,2016,ACM Digital Library,Study describing digital tabletop techniques,Accepted,
The eLabBench in the wild: supporting exploration in a molecular biology lab,2012,ACM Digital Library,Study describing digital tabletop techniques,Accepted,
Development of eye-tracking pen display based on stereo bright pupil technique,2010,ACM Digital Library,Study describing digital tabletop techniques,Accepted,
"uTable: a seamlessly tiled, very large interactive tabletop system",2011,ACM Digital Library,Study describing digital tabletop techniques,Accepted,
Hyakunin-Eyesshu: a tabletop Hyakunin-Isshu game with computer opponent by the action prediction based on gaze detection,2011,ACM Digital Library,Study describing digital tabletop techniques,Accepted,
Tangible jukebox: back to palpable music,2010,ACM Digital Library,Study describing digital tabletop techniques,Accepted,
Recognizing Unintentional Touch on Interactive Tabletop,2020,ACM Digital Library,Study describing digital tabletop techniques,Accepted,
Teachable Reality: Prototyping Tangible Augmented Reality with Everyday Objects by Leveraging Interactive Machine Teaching,2023,ACM Digital Library,Study describing digital tabletop techniques,Accepted,
Tangible Chromatin: Tangible and Multi-surface Interactions for Exploring Datasets from High-Content Microscopy Experiments,2022,ACM Digital Library,Study describing digital tabletop techniques,Accepted,
Tangible Reels: Construction and Exploration of Tangible Maps by Visually Impaired Users,2016,ACM Digital Library,Study describing digital tabletop techniques,Accepted,
Comparing the Tangible Tutorial System and the Human Teacher in Intangible Cultural Heritage Education,2020,ACM Digital Library,Study describing digital tabletop techniques,Accepted,
Supporting the Assessment of Collaborative Design Activities in Multi-tabletop Classrooms,2015,IEEE Digital Library,Study describing digital tabletop techniques,Accepted,
Management of Distributed RFID Surfaces: A Cooking Assistant for Ambient Computing in Kitchen,2014,Science@Direct,Study describing digital tabletop techniques,Accepted,
"The design, development, and deployment of a tabletop interface for collaborative exploration of genomic data",2012,Science@Direct,Study describing digital tabletop techniques,Accepted,
Investigation of fingertip blobs on optical multi-touch screen,2010,IEEE Digital Library,Study describing digital tabletop techniques,Accepted,
Towards New Human-Machine Systems in contexts involving interactive table and tangible objects,2010,Science@Direct,Study describing digital tabletop techniques,Accepted,
Material interactions with tangible tabletops: A pragmatist perspective,2014,Scopus,Study describing digital tabletop techniques,Accepted,
Enabling Tangible Interaction on Non-touch Displays with Optical Mouse Sensor and Visible Light Communication,2022,ACM Digital Library,Study describing digital tabletop techniques,Accepted,
MP Remix: Relaxed WYSIWIS Immersive Interfaces for Mixed Presence Collaboration With 3D Content,2019,ACM Digital Library,Study describing digital tabletop techniques,Accepted,
Tangible Tensors: An Interactive System for Grasping Trends in Biological Systems Modeling,2019,ACM Digital Library,Study describing digital tabletop techniques,Accepted,
Tangible BioNets: Multi-Surface and Tangible Interactions for Exploring Structural Features of Biological Networks,2019,ACM Digital Library,Study describing digital tabletop techniques,Accepted,
SciSketch: a tabletop collaborative sketching system,2014,ACM Digital Library,Study describing digital tabletop techniques,Accepted,
Novel interaction techniques based on a combination of hand and foot gestures in tabletop environments,2012,ACM Digital Library,Study describing digital tabletop techniques,Accepted,
The multi-touch SoundScape renderer,2008,ACM Digital Library,Study describing digital tabletop techniques,Accepted,
Visualization and User-Modeling for Browsing Personal Photo Libraries,2004,Springer Link,Study describing digital tabletop techniques,Accepted,
Gesture-Based Interactions on Multiple Large Displays with a Tabletop Interface,2007,Springer Link,Study describing digital tabletop techniques,Accepted,
Collaborative video searching on a tabletop,2006,Springer Link,Study describing digital tabletop techniques,Accepted,
u-Table: A Tabletop Interface for Multiple Users,2006,Springer Link,Study describing digital tabletop techniques,Accepted,
Shared Design Space: Sketching Ideas Using Digital Pens and a Large Augmented Tabletop Setup,2006,Springer Link,Study describing digital tabletop techniques,Accepted,
TMAR: Extension of a Tabletop Interface Using Mobile Augmented Reality,2008,Springer Link,Study describing digital tabletop techniques,Accepted,
A Tabletop Interface Using Controllable Transparency Glass for Collaborative Card-Based Creative Activity,2008,Springer Link,Study describing digital tabletop techniques,Accepted,
Vision-Based Projected Tabletop Interface for Finger Interactions,2007,Springer Link,Study describing digital tabletop techniques,Accepted,
A Multi-Agent System Approach for Interactive Table Using RFID,2010,Springer Link,Study describing digital tabletop techniques,Accepted,
Future Dining Table: Dish Recommendation Based on Dining Activity Recognition,2010,Springer Link,Study describing digital tabletop techniques,Accepted,
New Human-Computer Interactions Using Tangible Objects: Application on a Digital Tabletop with RFID Technology,2009,Springer Link,Study describing digital tabletop techniques,Accepted,
A Steerable Tangible Interface and Its Evaluation,2010,Springer Link,Study describing digital tabletop techniques,Accepted,
A Tabletop-Based Real-World-Oriented Interface,2011,Springer Link,Study describing digital tabletop techniques,Accepted,
Mojo iCuisine: The Design and Implementation of an Interactive Restaurant Tabletop Menu,2011,Springer Link,Study describing digital tabletop techniques,Accepted,
Trackable Interactive Multimodal Manipulatives: Towards a Tangible User Environment for the Blind,2012,Springer Link,Study describing digital tabletop techniques,Accepted,
TinkerLamp 2.0: Designing and Evaluating Orchestration Technologies for the Classroom,2012,Springer Link,Study describing digital tabletop techniques,Accepted,
Effects of a Tabletop Interface on the Co-construction of Concept Maps,2011,Springer Link,Study describing digital tabletop techniques,Accepted,
Multimedia Framework for Application of Spatial Auditory Information to Learning Materials,2013,Springer Link,Study describing digital tabletop techniques,Accepted,
MARIO: Mid-Air Augmented RealityInteraction with Objects,2013,Springer Link,Study describing digital tabletop techniques,Accepted,
Research on a Large Digital Desktop Integrated in a Traditional Environment for Informal Collaboration,2013,Springer Link,Study describing digital tabletop techniques,Accepted,
Towards Multimodal 3D Tabletop Interaction Using Sensor Equipped Mobile Devices,2013,Springer Link,Study describing digital tabletop techniques,Accepted,
Evaluation of a Soft-Surfaced Multi-touch Interface,2013,Springer Link,Study describing digital tabletop techniques,Accepted,
Detecting interaction above digital tabletops using a single depth camera,2013,Springer Link,Study describing digital tabletop techniques,Accepted,
MovemenTable: The Design of Moving Interactive Tabletops,2015,Springer Link,Study describing digital tabletop techniques,Accepted,
In-Situ Occlusion Resolution for Hybrid Tabletop Environments,2015,Springer Link,Study describing digital tabletop techniques,Accepted,
Around-Device Interactions: A Usability Study of Frame Markers in Acquisition Tasks,2015,Springer Link,Study describing digital tabletop techniques,Accepted,
On the Integration of Tangible Elements with Multi-touch Surfaces for the Collaborative Creation of Concept Maps,2016,Springer Link,Study describing digital tabletop techniques,Accepted,
Tangible Mixed Reality On-Site: Interactive Augmented Visualisations from Architectural Working Models in Urban Design,2015,Springer Link,Study describing digital tabletop techniques,Accepted,
Tangible Voting: A Technique for Interacting with Group Choices on a Tangible Tabletop,2015,Springer Link,Study describing digital tabletop techniques,Accepted,
Multi-tabletop System to Support Collaborative Design Assessment,2015,Springer Link,Study describing digital tabletop techniques,Accepted,
Hexart: Smart Merged Touch Tables,2015,Springer Link,Study describing digital tabletop techniques,Accepted,
RFID interactive tabletop application with tangible objects: exploratory study to observe young children’ behaviors,2015,Springer Link,Study describing digital tabletop techniques,Accepted,
Evaluating the effectiveness of spatial augmented reality in smart manufacturing: a solution for manual working stations,2017,Springer Link,Study describing digital tabletop techniques,Accepted,
ImmertableApp: Interactive and Tangible Learning Music Environment,2016,Springer Link,Study describing digital tabletop techniques,Accepted,
Side-by-Side Human–Computer Design Using a Tangible User Interface,2019,Springer Link,Study describing digital tabletop techniques,Accepted,
Visualization techniques for circular tabletop interfaces,2002,Scopus,Study describing digital tabletop techniques,Accepted,
A slim tabletop interface based on high resolution LCD screens with multiple cameras,2010,Scopus,Study describing digital tabletop techniques,Accepted,
UbiTable: Impromptu face-to-face collaboration on horizontal interactive surfaces,2003,Scopus,Study describing digital tabletop techniques,Accepted,
A 2D-3D integrated tabletop environment for multi-user collaboration,2007,Scopus,Study describing digital tabletop techniques,Accepted,
Transparent tabletop interface for multiple users on Lumisight Table,2006,Scopus,Study describing digital tabletop techniques,Accepted,
Combinatorix: A tangible user interface that supports collaborative learning of probabilities,2012,Scopus,Study describing digital tabletop techniques,Accepted,
Tangible 3D tabletops: Combining tangible tabletop interaction and 3D projection,2012,Scopus,Study describing digital tabletop techniques,Accepted,
Research on the tangible tabletop interaction system based on the optical sensors,2011,Scopus,Study describing digital tabletop techniques,Accepted,
A slim and wide multi-touch tabletop interface and its applications,2014,Scopus,Study describing digital tabletop techniques,Accepted,
Towards fast multi-point force and hit detection in tabletops using mechanically intercoupled force sensing resistors,2012,Scopus,Study describing digital tabletop techniques,Accepted,
MisTable: Reach-through personal screens for tabletops,2014,Scopus,Study describing digital tabletop techniques,Accepted,
A slim hybrid multi-touch tabletop interface with a high definition LED display and multiple cameras,2012,Scopus,Study describing digital tabletop techniques,Accepted,
PeriTop: Extending back-projected tabletops with top-projected peripheral displays,2013,Scopus,Study describing digital tabletop techniques,Accepted,
AR Tabletop Interface using a Head-Mounted Projector,2017,Scopus,Study describing digital tabletop techniques,Accepted,
Eye-tracking volume simulation method to configure hardware settings for tangible and multi-user tabletop interaction,2013,Scopus,Study describing digital tabletop techniques,Accepted,
Transparent electrostatic actuator with mesh-structured electrodes for driving tangible icon in tabletop interface,2014,Scopus,Study describing digital tabletop techniques,Accepted,
MakeBronze: An interactive system to promote Chinese bronze culture in children through hands-on experience with lost-wax casting,2024,Science@Direct,Study describing digital tabletop techniques,Accepted,
A Novel Workbench for Collaboratively Constructing 3D Virtual Environment,2018,Science@Direct,Study describing digital tabletop techniques,Accepted,
Low-fidelity prototyping with simple collaborative tabletop computer-aided design systems,2018,Science@Direct,Study describing digital tabletop techniques,Accepted,
Browsing museum image collections on a multi-touch table,2012,Science@Direct,Study describing digital tabletop techniques,Accepted,
Pen and paper techniques for physical customisation of tabletop interfaces,2008,IEEE Digital Library,Study describing digital tabletop techniques,Accepted,
A Table-Top Interface for Real-Time Coaching in Abacus Learning,2024,IEEE Digital Library,Study describing digital tabletop techniques,Accepted,
A system to recommend dishes by the real time recognition of dining activity,2010,IEEE Digital Library,Study describing digital tabletop techniques,Accepted,
ARmy: A study of multi-user interaction in spatially augmented games,2012,IEEE Digital Library,Study describing digital tabletop techniques,Accepted,
Learning Environment based on an Interactive Projection Table for Children,2021,IEEE Digital Library,Study describing digital tabletop techniques,Accepted,
T3: Rapid Prototyping of High-Resolution and Mixed-Presence Tabletop Applications,2007,IEEE Digital Library,Study describing digital tabletop techniques,Accepted,
Hand gesture interaction using color-based method for tabletop interfaces,2011,IEEE Digital Library,Study describing digital tabletop techniques,Accepted,
PapARt: Interactive 3D graphics and multi-touch augmented paper for artistic creation,2012,IEEE Digital Library,Study describing digital tabletop techniques,Accepted,
Paper-top interface for supporting note-taking and its preliminary experiment,2010,IEEE Digital Library,Study describing digital tabletop techniques,Accepted,
