title,year,source,selection_criteria,status,comments
Understanding file access mechanisms for embedded ubicomp collaboration interfaces,2009,Scopus,,Duplicated,
Utilizing digital tabletops in collocated agile planning meetings,2008,Scopus,,Duplicated,
Depth-sensing video cameras for 3D tangible tabletop interaction,2007,Scopus,,Duplicated,
A set of customizable games supporting therapy of children with cerebral palsy,2011,Scopus,,Duplicated,
Territoriality in collaborative tabletop workspaces,2004,Scopus,,Duplicated,
Integrating point and touch for interaction with digital tabletop displays,2006,Scopus,,Duplicated,
Alerting accidents with ambiguity: A tangible tabletop application for safe and independent chemistry experiments,2010,Scopus,,Duplicated,
Exploring the effects of group size and table size on interactions with tabletop shared-display groupware,2004,Scopus,,Duplicated,
Experiences with building a thin form-factor touch and tangible tabletop,2008,Scopus,,Duplicated,
Gesture-based interactions on multiple large displays with a tabletop interface,2007,Scopus,,Duplicated,
Mapping place: Supporting cultural learning through a Lukasa-inspired tangible tabletop museum exhibit,2015,Scopus,,Duplicated,
Improving awareness of automated actions within digital tabletops,2012,Scopus,,Duplicated,
An interaction on a flat panel display using a planar 1-DOF electrostatic actuator,2011,Scopus,,Duplicated,
Videogame-based case studies for improving communication and attention in children with ASD,2018,Scopus,,Duplicated,
Reducing the Cognitive Load of Playing a Digital Tabletop Game with a Multimodal Interface,2022,Scopus,,Duplicated,
Supporting community participation in interactive exhibits,2014,Scopus,,Duplicated,
Co-located collaborative visual analytics around a tabletop display,2012,Scopus,,Duplicated,
Bridging the cross-cultural language divide through design,2018,Scopus,,Duplicated,
An asymmetric collaborative system for architectural-scale space design,2018,Scopus,,Duplicated,
Spatially aware tangible display interaction in a tabletop environment,2012,Scopus,,Duplicated,
Dynamic tangible user interface palettes,2013,Scopus,,Duplicated,
E-CORE (Embodied COgnitive REhabilitation): A cognitive rehabilitation system using tangible tabletop interface,2013,Scopus,,Duplicated,
AR tabletop interface using an optical see-through HMD,2016,Scopus,,Duplicated,
Designing cultural values into interaction,2017,Scopus,,Duplicated,
Exploring automation in digital tabletop board game,2012,Scopus,,Duplicated,
Let's jam the reactable: Peer learning during musical improvisation with a tabletop tangible interface,2013,Scopus,,Duplicated,
Tangible reels: Construction and exploration of tangible maps by visually impaired users,2016,Scopus,,Duplicated,
Tangible interaction and teacher education: Creating resources for students with different communication processes,2019,Scopus,,Duplicated,
JDLED: Towards visio-tactile displays based on electrochemical locomotion of liquid-metal Janus droplets,2017,Scopus,,Duplicated,
In-situ occlusion resolution for hybrid tabletop environments,2015,Scopus,,Duplicated,
"Using scalable, interactive floor projection for production planning scenario",2014,Scopus,,Duplicated,
Collaborative problem solving with objects: Physical aspects of a tangible tabletop in technology-based assessment,2012,Scopus,,Duplicated,
Assessment of Collaborative Problem Solving Using Linear Equations on a Tangible Tabletop,2014,Scopus,,Duplicated,
Supporting opportunistic search in meetings with tangible tabletop,2012,Scopus,,Duplicated,
Investigating menu discoverability on a digital tabletop in a public setting,2012,Scopus,,Duplicated,
Development of communication support system at mealtimes using tabletop interface,2013,Scopus,,Duplicated,
Exploring the layered use of transparent display on a large tabletop display,2016,Scopus,,Duplicated,
Around-device interactions: A usability study of frame markers in acquisition tasks,2015,Scopus,,Duplicated,
Dual Reality for Production Verification Workshops: A Comprehensive Set of Virtual Methods,2016,Scopus,,Duplicated,
Evaluating digital tabletop collaborative writing in the classroom,2015,Scopus,,Duplicated,
Designing and making a tangible tabletop game with ToyVision,2013,Scopus,,Duplicated,
Multitouch tabletop technology for people with autism spectrum disorder: A review of the literature,2012,Scopus,,Duplicated,
Interaction patterns for assessment of learners in tabletop based collaborative learning environment,2013,Scopus,,Duplicated,
Human Touch in Digital Experiences,2016,Scopus,,Duplicated,
Resolving display shape dependence issues on tabletops,2018,Scopus,,Duplicated,
Collaborative business process modeling in multi-surface environments,2017,Scopus,,Duplicated,
Towards geospatial tangible user interfaces: An observational user study exploring geospatial interactions of the novice,2016,Scopus,,Duplicated,
An immersive surface for 3D interactions,2012,Scopus,,Duplicated,
Effects of viewing conditions and rotation methods in a collaborative tabletop AR environment,2010,IEEE Digital Library,,Duplicated,
Resolving display shape dependence issues on tabletops,2018,IEEE Digital Library,,Duplicated,
Post-WIMP Interaction for Information Visualization ,2021,IEEE Digital Library,,Duplicated,
Localisation and interaction for augmented maps,2005,IEEE Digital Library,,Duplicated,
Storage bins: mobile storage for collaborative tabletop displays,2005,IEEE Digital Library,,Duplicated,
"Tangible user interfaces: past, present, and future directions",2010,IEEE Digital Library,,Duplicated,
AR Tabletop Interface using a Head-Mounted Projector,2016,IEEE Digital Library,,Duplicated,
User perceptions of adaptivity in an interactive narrative,2011,ACM Digital Library,,Duplicated,
Tables in the wild: lessons learned from a large-scale multi-tabletop deployment,2013,ACM Digital Library,,Duplicated,
Visualization techniques for circular tabletop interfaces,2002,ACM Digital Library,,Duplicated,
Doing community: co-construction of meaning and use with interactive information kiosks,2006,ACM Digital Library,,Duplicated,
Games and simulations in industrial engineering education: a review of the cognitive and affective learning outcomes,2018,ACM Digital Library,,Duplicated,
Tisch digital tools supporting board games,2012,ACM Digital Library,,Duplicated,
Collaborative visualization of simulated processes using tabletop fiducial augmented reality,2011,ACM Digital Library,,Duplicated,
"RoboJockey: real-time, simultaneous, and continuous creation of robot actions for everyone",2010,ACM Digital Library,,Duplicated,
Getting sidetracked: display design and occasioning photo-talk with the photohelix,2009,ACM Digital Library,,Duplicated,
Solar scramble: an educational children's game for collaborative multi-touch digital tabletops,2010,ACM Digital Library,,Duplicated,
Light on horizontal interactive surfaces: Input space for tabletop computing,2014,ACM Digital Library,,Duplicated,
"Dollhouse VR: a multi-view, multi-user collaborative design workspace with VR technology",2015,ACM Digital Library,,Duplicated,
Modelling symmetry of activity as an indicator of collocated group collaboration,2011,ACM Digital Library,,Duplicated,
Hugin: a framework for awareness and coordination in mixed-presence collaborative information visualization,2010,ACM Digital Library,,Duplicated,
"Sketched menus and iconic gestures, techniques designed in the context of shareable interfaces",2010,ACM Digital Library,,Duplicated,
Sketched menu: a tabletop-menu technique for GUI object creation,2010,ACM Digital Library,,Duplicated,
DiamondSpin: an extensible toolkit for around-the-table interaction,2004,ACM Digital Library,,Duplicated,
Interactive tabletops with non-interactive rims,2010,ACM Digital Library,,Duplicated,
MisTable: reach-through personal screens for tabletops,2014,ACM Digital Library,,Duplicated,
Improving awareness of automated actions using an interactive event timeline,2013,ACM Digital Library,,Duplicated,
Actions speak loudly with words: unpacking collaboration around the table,2009,ACM Digital Library,,Duplicated,
PeriTop: extending back-projected tabletops with top-projected peripheral displays,2013,ACM Digital Library,,Duplicated,
Robotic Task Complexity and Collaborative Behavior of Children with ASD,2022,ACM Digital Library,,Duplicated,
"Dollhouse VR: a multi-view, multi-user collaborative design workspace with VR technology",2015,ACM Digital Library,,Duplicated,
Architales: physical/digital co-design of an interactive story table,2009,ACM Digital Library,,Duplicated,
Material interactions with tangible tabletops: a pragmatist perspective,2014,ACM Digital Library,,Duplicated,
Venice unfolding: a tangible user interface for exploring faceted data in a geographical context,2010,ACM Digital Library,,Duplicated,
Tangible anchoring: grasping news and public opinion,2010,ACM Digital Library,,Duplicated,
Combinatorix: a tangible user interface that supports collaborative learning of probabilities,2012,ACM Digital Library,,Duplicated,
Communicative behaviors and flow experience in tabletop gaming,2009,ACM Digital Library,,Duplicated,
StoryCrate: tabletop storyboarding for live film production,2012,ACM Digital Library,,Duplicated,
Rethinking 'multi-user': an in-the-wild study of how groups approach a walk-up-and-use tabletop interface,2011,ACM Digital Library,,Duplicated,
Engaging families around museum exhibits: comparing tangible and multi-touch interfaces,2020,ACM Digital Library,,Duplicated,
Tangible 3D tabletops: combining tangible tabletop interaction and 3D projection,2012,ACM Digital Library,,Duplicated,
"Collaborative sensemaking on a digital tabletop and personal tablets: prioritization, comparisons, and tableaux",2013,ACM Digital Library,,Duplicated,
Technologies for the Design Review Process,2024,Springer Link,,Duplicated,
Media crate: Tangible live media production interface,2009,Scopus,,Duplicated,
Exploring tabletop file system interaction,2007,Scopus,,Duplicated,
A-CUBE: A tangible tabletop application to support safe and independent chemistry experiments,2010,Scopus,,Duplicated,
Toward emotional interactive videogames for children with autism spectrum disorder,2021,Scopus,,Duplicated,
Using MTCF for live prototyping on tablet and tangible tabletop devices,2013,Scopus,,Duplicated,
TerraGuide: Design and evaluation of a multi-surface environment for terrain visibility analysis,2015,Scopus,,Duplicated,
Tangible interactions on a flat panel display using actuated paper sheets,2012,Scopus,,Duplicated,
An environment for collaborative iteration planning,2005,IEEE Digital Library,,Duplicated,
Transparent tabletop interface for multiple users on Lumisight table,2006,IEEE Digital Library,,Duplicated,
An exploratory study of co-located collaborative visual analytics around a tabletop display,2010,IEEE Digital Library,,Duplicated,
A slim hybrid multi-touch tabletop interface with a high definition LED display and multiple cameras,2012,IEEE Digital Library,,Duplicated,
A slim and wide multi-touch tabletop interface and its applications,2014,IEEE Digital Library,,Duplicated,
A 3D Flexible and Tangible Magic Lens in Augmented Reality,2007,ACM Digital Library,,Duplicated,
CRISTAL: a collaborative home media and device controller based on a multi-touch display,2009,ACM Digital Library,,Duplicated,
ObjecTop: occlusion awareness of physical objects on interactive tabletops,2013,ACM Digital Library,,Duplicated,
Towards tabletop interaction with everyday artifacts via pressure imaging,2010,ACM Digital Library,,Duplicated,
Eye-tracking volume simulation method to configure hardware settings for tangible and multi-user tabletop interaction,2013,ACM Digital Library,,Duplicated,
Design and evaluation of graphical feedback on tangible interactions in a low-resolution edge display,2019,ACM Digital Library,,Duplicated,
A slim tabletop interface based on high resolution LCD screens with multiple cameras,2010,ACM Digital Library,,Duplicated,
“Whoa! We’re going deep in the trees!”: Patterns of collaboration around an interactive information visualization exhibit,2015,Springer Link,Articles that omits the tabletop technique,Rejected,
PAR: A Collaborative Game for Multitouch Tabletop to Support Social Interaction of Users with Autism,2014,Science@Direct,Articles that omits the tabletop technique,Rejected,
Informing the Design of Direct-Touch Tabletops,2006,IEEE Digital Library,Articles that omits the tabletop technique,Rejected,"É uma survey, não trata sobre nenhuma tabletop em específico"
MTMR: A conceptual interior design framework integrating Mixed Reality with the Multi-Touch tabletop interface,2010,IEEE Digital Library,Articles that omits the tabletop technique,Rejected,Omite como funciona o display e como o input é detectado
Designing an adaptive multimedia interactive to support shared learning experiences,2006,ACM Digital Library,Articles that omits the tabletop technique,Rejected,
Blended interaction spaces for distributed team collaboration,2011,ACM Digital Library,Articles that omits the tabletop technique,Rejected,
"Demonstrating SurfaceCast: Ubiquitous, Cross-Device Surface Sharing",2023,ACM Digital Library,Articles that omits the tabletop technique,Rejected,"É um baita artigo, mas infelizmente é uma aplicação que funciona pra qualquer técnica de tabletop"
Networks of innovation: the sociotechnical assemblage of tabletop computing,2019,Science@Direct,Articles that omits the tabletop technique,Rejected,
Toy user interfaces: Systematic and industrial mapping,2019,Science@Direct,Articles that omits the tabletop technique,Rejected,
Making L2 learners’ reasoning skills visible: The potential of Computer Supported Collaborative Learning Environments,2016,Science@Direct,Articles that omits the tabletop technique,Rejected,
Achieving the performance benefits of hands-on experience when using digital devices: A representational approach,2016,Science@Direct,Articles that omits the tabletop technique,Rejected,
Munin: A Peer-to-Peer Middleware for Ubiquitous Analytics and Visualization Spaces,2015,IEEE Digital Library,Articles that omits the tabletop technique,Rejected,
TTUI-SM: A New Specification Model for Tabletop Tangible User Interfaces,2014,IEEE Digital Library,Articles that omits the tabletop technique,Rejected,
Gathering Alternative Solutions for New Requirements in Manufacturing Company: Collaborative Process with Data Visualization and Interaction Support,2012,Science@Direct,Articles that omits the tabletop technique,Rejected,
Reactive Variability Management in Agile Software Development,2010,IEEE Digital Library,Articles that omits the tabletop technique,Rejected,
"Hidden Markov Model based gesture recognition on low-cost, low-power Tangible User Interfaces",2009,Science@Direct,Articles that omits the tabletop technique,Rejected,
Bridging the gap between the Kodak and the Flickr generations: A novel interaction technique for collocated photo sharing,2009,Science@Direct,Articles that omits the tabletop technique,Rejected,
"Characterizing parent-child communication, affect, and collaboration during multi-user digital tabletop gameplay",2020,Scopus,Articles that omits the tabletop technique,Rejected,
Combining relevance information in a synchronous collaborative information retrieval environment,2009,Scopus,Articles that omits the tabletop technique,Rejected,
A handheld classroom dashboard: Teachers’ perspectives on the use of real-time collaborative learning analytics,2019,Springer Link,Articles that omits the tabletop technique,Rejected,
Accessibility and tangible interaction in distributed workspaces based on multi-touch surfaces,2017,Springer Link,Articles that omits the tabletop technique,Rejected,
Tangible Interfaces Support Young Children’s Goal Interdependence,2022,ACM Digital Library,Articles that omits the tabletop technique,Rejected,
Methodologies and Evaluation Tools Used in Tangible User Interfaces: A Systematic Literature Review,2018,ACM Digital Library,Articles that omits the tabletop technique,Rejected,
Towards a Framework for Tangible Narratives,2016,ACM Digital Library,Articles that omits the tabletop technique,Rejected,
Sound Localization on Tabletop Computers: A Comparison of Two Amplitude Panning Methods,2015,ACM Digital Library,Articles that omits the tabletop technique,Rejected,
Conceptual framework for surface manager on interactive tabletops,2013,ACM Digital Library,Articles that omits the tabletop technique,Rejected,
Interactive prototyping of tabletop and surface applications,2013,ACM Digital Library,Articles that omits the tabletop technique,Rejected,
ToyVision: a toolkit to support the creation of innovative board-games with tangible interaction,2013,ACM Digital Library,Articles that omits the tabletop technique,Rejected,
A user experience view for rehabilitation systems,2012,ACM Digital Library,Articles that omits the tabletop technique,Rejected,
Seamless mixed reality tracking in tabletop reservoir engineering interaction,2012,ACM Digital Library,Articles that omits the tabletop technique,Rejected,
Virtual stage linked with a physical miniature stage to support multiple users in planning theatrical productions,2012,ACM Digital Library,Articles that omits the tabletop technique,Rejected,
Dynamic portals: a lightweight metaphor for fast object transfer on interactive surfaces,2011,ACM Digital Library,Articles that omits the tabletop technique,Rejected,
Outage on the table: the design of interactive surfaces for collaborative operation in outage control centres,2011,ACM Digital Library,Articles that omits the tabletop technique,Rejected,
The interface is on the table: Systematic Literature Review about interaction design to applications for tangible tabletops.,2024,ACM Digital Library,Articles that omits the tabletop technique,Rejected,
OA-graphs: orientation agnostic graphs for improving the legibility of charts on horizontal displays,2010,ACM Digital Library,Articles that omits the tabletop technique,Rejected,
Exploring gesture-based interaction techniques in multi-display environments with mobile phones and a multi-touch table,2010,ACM Digital Library,Articles that omits the tabletop technique,Rejected,
Hands on what? comparing children's mouse-based and tangible-based interaction,2009,ACM Digital Library,Articles that omits the tabletop technique,Rejected,
reacTIVision and TUIO: a tangible tabletop toolkit,2009,ACM Digital Library,Articles that omits the tabletop technique,Rejected,
Examination of Text-Entry Methods for Tabletop Displays,2007,IEEE Digital Library,Articles that omits the tabletop technique,Rejected,
Territoriality in collaborative tabletop workspaces,2004,ACM Digital Library,Articles that omits the tabletop technique,Rejected,
Evaluating Physical/Virtual Occlusion Management Techniques for Horizontal Displays,2011,Springer Link,Articles that omits the tabletop technique,Rejected,
Multi-user tangible interfaces for effective decision-making in disaster management,2008,Springer Link,Articles that omits the tabletop technique,Rejected,"Artigo menciona a ""nova tecnologia"" que estava surgindo na época (Multi-User Tangible Tabletop Interface), menciona Microsoft Surface e DiamondTouch, faz uma pesquisa sobre como essa tecnologia pode ser aplicada pra controle de desastres. Mas não chega a usar nenhuma mesa específica."
Wave Touch: Educational Game on Interactive Tabletop with Water Simulation,2010,Springer Link,Articles that omits the tabletop technique,Rejected,
Tools for Supporting Distributed Agile Project Planning,2010,Springer Link,Articles that omits the tabletop technique,Rejected,
Computers in the Human Interaction Loop,2010,Springer Link,Articles that omits the tabletop technique,Rejected,
Investigating the Impact of Data Transfer User Interfaces on Communication Grounding in Cross- Device Environments,2018,ACM Digital Library,Articles that omits the tabletop technique,Rejected,
"System Guidelines for Co-located, Collaborative Work on a Tabletop Display",2003,Springer Link,Articles that omits the tabletop technique,Rejected,
Configuring Spaces and Surfaces to Support Collaborative Interactions,2003,Springer Link,Articles that omits the tabletop technique,Rejected,
Citywide: Supporting Interactive Digital Experiences Across Physical Space,2002,Springer Link,Articles that omits the tabletop technique,Rejected,
Using Horizontal Displays for Distributed and Collocated Agile Planning,2007,Springer Link,Articles that omits the tabletop technique,Rejected,
From Clicks to Touches: Enabling Face-to-Face Shared Social Interface on Multi-touch Tabletops,2007,Springer Link,Articles that omits the tabletop technique,Rejected,
Paper Metaphor for Tabletop Interaction Design,2007,Springer Link,Articles that omits the tabletop technique,Rejected,
Doing Community: Co-construction of Meaning and Use with Interactive Information Kiosks,2006,Springer Link,Articles that omits the tabletop technique,Rejected,
Interface Currents: Supporting Fluent Collaboration on Tabletop Displays,2005,Springer Link,Articles that omits the tabletop technique,Rejected,
APDT: An Agile Planning Tool for Digital Tabletops,2008,Springer Link,Articles that omits the tabletop technique,Rejected,
From Desktop to Tabletop: Migrating the User Interface of AgilePlanner,2008,Springer Link,Articles that omits the tabletop technique,Rejected,
A Tangible Tabletop Game Supporting Therapy of Children with Cerebral Palsy,2008,Springer Link,Articles that omits the tabletop technique,Rejected,
Augmented Collaborative Card-Based Creative Activity with Digital Pens,2009,Springer Link,Articles that omits the tabletop technique,Rejected,
Creation and Collaboration: Engaging New Audiences for Information Visualization,2008,Springer Link,Articles that omits the tabletop technique,Rejected,
Creating ambient music spaces in real and virtual worlds,2009,Springer Link,Articles that omits the tabletop technique,Rejected,
Collaborative Tabletop Research and Evaluation: Interfaces and Interactions for Direct-Touch Horizontal Surfaces,2008,Springer Link,Articles that omits the tabletop technique,Rejected,
Rapidly Prototyping Marker Based Tangible User Interfaces,2009,Springer Link,Articles that omits the tabletop technique,Rejected,
Design of Systems for Supporting Collaborative Learning Augmented with Physical Artefacts,2008,Springer Link,Articles that omits the tabletop technique,Rejected,
Interactive Displays and Next-Generation Interfaces,2010,Springer Link,Articles that omits the tabletop technique,Rejected,
Supporting Atomic User Actions on the Table,2010,Springer Link,Articles that omits the tabletop technique,Rejected,
Using Heuristics to Evaluate the Overall User Experience of Video Games and Advanced Interaction Games,2009,Springer Link,Articles that omits the tabletop technique,Rejected,
Theory of Tabletop Territoriality,2010,Springer Link,Articles that omits the tabletop technique,Rejected,
Hidden Markov Models Implementation for Tangible Interfaces,2009,Springer Link,Articles that omits the tabletop technique,Rejected,
High-Resolution Interactive Displays,2010,Springer Link,Articles that omits the tabletop technique,Rejected,É um estudo sobre diferentes formas de alcançar display de alta resolução para tabletops na época.
Optical Design of Tabletop Displays and Interactive Applications,2010,Springer Link,Articles that omits the tabletop technique,Rejected,
Tangible Interaction in Mixed Reality Systems,2009,Springer Link,Articles that omits the tabletop technique,Rejected,
uPlatform: A Customizable Multi-user Windowing System for Interactive Tabletop,2011,Springer Link,Articles that omits the tabletop technique,Rejected,
User Perceptions of Adaptivity in an Interactive Narrative,2011,Springer Link,Articles that omits the tabletop technique,Rejected,
"Tabletop Games: Platforms, Experimental Games and Design Recommendations",2010,Springer Link,Articles that omits the tabletop technique,Rejected,
Horizontal Interactive Surfaces in Distributed Assemblies,2010,Springer Link,Articles that omits the tabletop technique,Rejected,
Natural Human–Computer Interaction,2010,Springer Link,Articles that omits the tabletop technique,Rejected,
Coordination and Awareness in Remote Tabletop Collaboration,2010,Springer Link,Articles that omits the tabletop technique,Rejected,
"Introduction: A Short History of Tabletop Research, Technologies, and Products",2010,Springer Link,Articles that omits the tabletop technique,Rejected,
Digital Tables for Collaborative Information Exploration,2010,Springer Link,Articles that omits the tabletop technique,Rejected,
Modelling Symmetry of Activity as an Indicator of Collocated Group Collaboration,2011,Springer Link,Articles that omits the tabletop technique,Rejected,
"Tablexcel: A Multi-user, Multi-touch Interactive Tabletop Interface for Microsoft Excel Spreadsheets",2011,Springer Link,Articles that omits the tabletop technique,Rejected,
Hidden Details of Negotiation: The Mechanics of Reality-Based Collaboration in Information Seeking,2011,Springer Link,Articles that omits the tabletop technique,Rejected,
The Understanding of Meaningful Events in Gesture-Based Interaction,2011,Springer Link,Articles that omits the tabletop technique,Rejected,
Facilitating Knowledge Transfer in IANES - A Transactive Memory Approach,2013,Springer Link,Articles that omits the tabletop technique,Rejected,
Designing with and for Older Adults: Experience from Game Design,2012,Springer Link,Articles that omits the tabletop technique,Rejected,
Shared Interfaces for Co-located Interaction,2012,Springer Link,Articles that omits the tabletop technique,Rejected,
Creating Metaphors for Tangible User Interfaces in Collaborative Urban Planning: Questions for Designers and Developers,2012,Springer Link,Articles that omits the tabletop technique,Rejected,
